{"canonical_json_profile":"pcs-jcs-rfc8785-v1","certificate_integrity_hash":"0274271466110e9ac5af500dcb5682880a89c4d3529f63b8141eb5b17e272509","certificate_semantic_hash":"f3471c37a7cb90caec88909f3a69de7285b2b74011ac8260741da1bb473d5998","entries":[{"claim_id":"C1","decision":"COMPUTATIONALLY_SUPPORTED","path":"normalized/ab861dc170dc2e43224e4527.json","wire_semantic_hash":"e7fe1b888698f8a06eba17e3f7d6d70142e08e2be2deb580e20c24411b3cd6a5"}],"index_format":"pcs-normalized-decision-index-v2","index_hash_format":"pcs-normalized-index-sha256-v2","index_semantic_hash":"4d8b0ed55b418d490ab92725ed03be466c42cfbc83b675012aff51076fe7ba61"}